Sheet: bateria05_speed
C1: FPS
A2: Stopwatches | C2: 60 | E2: Speed (m/s) m.s-1 | F2: Speed (km/h)
A3: Label | B3: Duration | C3: Tempo | D3: Distancia | E3: Velocidade Escalar (m/s) | F3: Velocidade Escalar (km/h)
A4: Preto1 | B4: 235 | C4: =RC[-1]*(1/R2C) -> 3.91666666666667 | D4: 20 | E4: =RC[-1]/RC[-2] -> 5.1063829787234 | F4: =RC[-1]*3,6 -> 18.3829787234043
A5: Preto2 | B5: 240 | C5: =RC[-1]*(1/R2C) -> 4 | D5: 20 | E5: =RC[-1]/RC[-2] -> 5 | F5: =RC[-1]*3,6 -> 18
A6: Preto3 | B6: 247 | C6: =RC[-1]*(1/R2C) -> 4.11666666666667 | D6: 20 | E6: =RC[-1]/RC[-2] -> 4.8582995951417 | F6: =RC[-1]*3,6 -> 17.4898785425101
A7: Preto4 | B7: 250 | C7: =RC[-1]*(1/R2C) -> 4.16666666666667 | D7: 20 | E7: =RC[-1]/RC[-2] -> 4.8 | F7: =RC[-1]*3,6 -> 17.28
A8: Preto10 | B8: 239 | C8: =RC[-1]*(1/R2C) -> 3.98333333333333 | D8: 20 | E8: =RC[-1]/RC[-2] -> 5.02092050209205 | F8: =RC[-1]*3,6 -> 18.0753138075314

Sheet: bateria05_velocity
C1: FPS
A2: Stopwatches | C2: 60 | G2: Velocity | H2: Velocity
A3: Label | B3: Duration | C3: Tempo | D3: Si | E3: Sf | F3: Deslocamento | G3: Velocidade Vetorial (m/s) | H3: Velocidade Escalar (km/h)
A4: Preto1 | B4: 235 | C4: =RC[-1]*(1/R2C) -> 3.91666666666667 | D4: 0 | E4: 20 | F4: =RC[-1]-RC[-2] -> 20 | G4: =RC[-1]/RC[-4] -> 5.1063829787234 | H4: =RC[-1]*3,6 -> 18.3829787234043
A5: Preto2 | B5: 240 | C5: =RC[-1]*(1/R2C) -> 4 | D5: 20 | E5: 0 | F5: =RC[-1]-RC[-2] -> -20 | G5: =RC[-1]/RC[-4] -> -5 | H5: =RC[-1]*3,6 -> -18
A6: Preto3 | B6: 247 | C6: =RC[-1]*(1/R2C) -> 4.11666666666667 | D6: 0 | E6: 20 | F6: =RC[-1]-RC[-2] -> 20 | G6: =RC[-1]/RC[-4] -> 4.8582995951417 | H6: =RC[-1]*3,6 -> 17.4898785425101
A7: Preto4 | B7: 250 | C7: =RC[-1]*(1/R2C) -> 4.16666666666667 | D7: 20 | E7: 0 | F7: =RC[-1]-RC[-2] -> -20 | G7: =RC[-1]/RC[-4] -> -4.8 | H7: =RC[-1]*3,6 -> -17.28
A8: Preto10 | B8: 239 | C8: =RC[-1]*(1/R2C) -> 3.98333333333333 | D8: 20 | E8: 0 | F8: =RC[-1]-RC[-2] -> -20 | G8: =RC[-1]/RC[-4] -> -5.02092050209205 | H8: =RC[-1]*3,6 -> -18.0753138075314